{
  "company": "株式会社レノバ",
  "ticker": "9519",
  "fye_month": 3,
  "accounting_standard": "IFRS",

  "thesis": {
    "statement": "レノバは、開発した再エネ発電所を長期保有して安定売電CFを生む『発電（ストック）』と、開発・運営報酬の『フロー』の二階建てモデルで、第7次エネルギー基本計画（2040年度 再エネ40〜50%）の構造的追い風の下、バイオマス・蓄電・Non-FIT/PPAへ電源を多様化しながら連結EBITDAを継続成長させられる。",
    "kill_questions": [
      "発電事業のセグメントEBITDA率がFY2021 70.5%→FY2025 39.3%へ低下している。バイオマス燃料費（木質ペレット/PKS）上昇が構造的にマージンを侵食し、FIT/FIPや燃料費調整で価格転嫁できない契約構造なら、発電容量を拡大しても利益が伴わない可能性を否定できるか。",
      "開発・運営事業のセグメントEBITDAが複数期赤字（FY2022 △1,674／FY2024 △1,777百万円）で、事業開発報酬は新規開発状況により大きく変動する。洋上風力公募の不確実性下で、この『フロー』収益は安定的な企業価値の源泉になり得るか。",
      "主力に据えた洋上風力（由利本荘）を2021年に落選し、成長の核を系統用蓄電（LTDA落札215MW・着工260MW）とNon-FIT/PPAに置換しつつある。蓄電・Non-FITは発電事業を代替する規模とマージンを確保できるか。",
      "プロジェクトファイナンス累計5,000億円超の資本集約モデルで、金融費用がFY2021 2,440→FY2025 5,886百万円へ増大している。金利上昇局面でもエクイティIRRを確保できるか。",
      "創業者・木南氏16.29%＋東京瓦斯13.02%＋住友林業8.06%の資本構成下で、PEがコントロール取得・ガバナンス変更を実現する現実的な経路はあるか。"
    ]
  },

  "periods": [
    {
      "label": "FY2021",
      "segment_sales": { "再生可能エネルギー発電等事業": 17651, "開発・運営事業": 2902 },
      "segment_profits": { "再生可能エネルギー発電等事業": 12442, "開発・運営事業": 508 },
      "inter_segment_elimination": 0,
      "hq_overhead": -2330,
      "consolidated_sales": 20553,
      "consolidated_op_profit": 10620,
      "consolidated_dep": 6015,
      "source": "有報 FY2021/3 docID S100LJD5 (2021-06-18)。consolidated_op_profit欄は連結EBITDA（注記参照）"
    },
    {
      "label": "FY2022",
      "segment_sales": { "再生可能エネルギー発電等事業": 27887, "開発・運営事業": 1320 },
      "segment_profits": { "再生可能エネルギー発電等事業": 16757, "開発・運営事業": -1674 },
      "inter_segment_elimination": 0,
      "hq_overhead": -1997,
      "consolidated_sales": 29207,
      "consolidated_op_profit": 13087,
      "consolidated_dep": 8256,
      "source": "有報 FY2022/3 docID S100O9MP (2022-06-17)。洋上風力(由利本荘)落選で由利本荘持分法損益△2,929等を計上"
    },
    {
      "label": "FY2023",
      "segment_sales": { "再生可能エネルギー発電等事業": 32072, "開発・運営事業": 1509 },
      "segment_profits": { "再生可能エネルギー発電等事業": 17714, "開発・運営事業": 2849 },
      "inter_segment_elimination": 0,
      "hq_overhead": -2462,
      "consolidated_sales": 33581,
      "consolidated_op_profit": 18101,
      "consolidated_dep": 9231,
      "source": "有報 FY2023/3 docID S100QZ6W (2023-06-20)"
    },
    {
      "label": "FY2024",
      "segment_sales": { "再生可能エネルギー発電等事業": 44331, "開発・運営事業": 417 },
      "segment_profits": { "再生可能エネルギー発電等事業": 22228, "開発・運営事業": -1777 },
      "inter_segment_elimination": 0,
      "hq_overhead": -3740,
      "consolidated_sales": 44748,
      "consolidated_op_profit": 16712,
      "consolidated_dep": 11235,
      "source": "有報 FY2024/3 docID S100TNIO (2024-06-20)。セグメント利益はFY2025有報の遡及修正後（受取配当金の科目振替）"
    },
    {
      "label": "FY2025",
      "segment_sales": { "再生可能エネルギー発電等事業": 68292, "開発・運営事業": 1954 },
      "segment_profits": { "再生可能エネルギー発電等事業": 26823, "開発・運営事業": 537 },
      "inter_segment_elimination": 0,
      "hq_overhead": -4052,
      "consolidated_sales": 70246,
      "consolidated_op_profit": 23307,
      "consolidated_dep": 16513,
      "source": "有報 FY2025/3 docID S100VZPK (2025-06-19)"
    }
  ],

  "table_b": {
    "seg_sales": { "再生可能エネルギー発電等事業": 68292, "開発・運営事業": 6102 },
    "seg_profits": { "再生可能エネルギー発電等事業": 26823, "開発・運営事業": 537 },
    "sales_ratios": { "再生可能エネルギー発電等事業": 91.80, "開発・運営事業": 8.20 },
    "profit_ratios": { "再生可能エネルギー発電等事業": 98.04, "開発・運営事業": 1.96 }
  },

  "value_up_bridge": {
    "current_ebitda": 233,
    "organic_low": 30,
    "organic_high": 70,
    "inorganic_low": 20,
    "inorganic_high": 60,
    "target_low": 283,
    "target_high": 363
  },

  "top_shareholders": {
    "ratios": [16.29, 13.02, 8.06, 5.96, 5.62, 5.48, 1.64, 1.57, 1.37, 1.30],
    "stated_total": 60.35
  },

  "market": [
    {
      "name": "日本 再エネFIT/FIP買取総額（再エネ発電事業の収益プール代理指標）",
      "size": 4.8,
      "size_unit": "兆円",
      "vintage": 2024,
      "period": "2023→2024",
      "kind": "予測",
      "cagr_pct": null,
      "source": "経済産業省 2025-03-21 報道発表（FIT/FIP買取価格・賦課金）。2024年度買取総額(予測)4.8兆円・賦課金2.7兆円"
    },
    {
      "name": "日本 再エネFIT/FIP買取総額（再エネ発電事業の収益プール代理指標）",
      "size": 4.9,
      "size_unit": "兆円",
      "vintage": 2025,
      "period": "2024→2025",
      "kind": "予測",
      "cagr_pct": 2.1,
      "source": "経済産業省 2025-03-21 報道発表。2025年度買取総額(予測)4.9兆円・賦課金3.1兆円(単価3.98円/kWh)"
    },
    {
      "name": "日本 洋上風力 導入目標（成長オプション市場：稼働容量）",
      "size": 10,
      "size_unit": "億円",
      "vintage": 2030,
      "period": "2025→2030",
      "kind": "予測",
      "cagr_pct": null,
      "source": "資源エネルギー庁 洋上風力政策資料。2030年10GW(稼働ベース5.7GW)・2040年30〜45GW。size値はGW(=10)を便宜上数値化したもので円換算ではない旨を本文で明記"
    }
  ],

  "share": [
    {
      "market": "日本 再エネFIT/FIP買取総額（再エネ発電事業の収益プール代理指標）",
      "company_revenue_oku": 702,
      "market_size_oku": 48000,
      "stated_share_pct": 1.5
    }
  ],

  "competitors": [
    { "name": "イーレックス株式会社", "ticker": "9517", "listed": "東証プライム", "source": "イーレックス 2025年3月期 決算短信〔IFRS〕(連結) 2025-05-12。売上高1,554.56億円/営業利益53.78億円/親会社帰属当期利益18.85億円" },
    { "name": "電源開発株式会社（J-POWER）", "ticker": "9513", "listed": "東証プライム", "source": "電源開発 有価証券報告書（国内最大級の電源開発・運営。風力/水力/地熱/火力を含む大型電力会社）" },
    { "name": "ジャパン・リニューアブル・エナジー株式会社（JRE）", "ticker": "", "listed": "非上場（ENEOSホールディングス子会社）", "source": "ENEOS 2023-01 JRE全株式取得（約2,000億円）。再エネ発電量 建設中含め約100万kW（環境金融研究機構/日経）" },
    { "name": "株式会社ユーラスエナジーホールディングス", "ticker": "", "listed": "非上場（豊田通商系）", "source": "ユーラスエナジーHD 会社公表/報道（国内外の大規模風力デベロッパー）" },
    { "name": "株式会社グリーンパワーインベストメント（GPI）", "ticker": "", "listed": "非上場（米Pattern Energy傘下、2022年）", "source": "GPI 会社公表/Wikipedia/報道（秋田港・能代港等の大規模風力）" }
  ],

  "notes": [
    "重要：レノバのセグメント利益は有報明示の通りEBITDA（Non-GAAP：売上収益−燃料費−外注費−人件費±持分法損益±その他）であり、IFRS連結営業利益(OperatingProfitLossIFRS)とは別概念。dd_model の periods.segment_profits / consolidated_op_profit は『セグメントEBITDA→連結EBITDA』の内部整合（ΣセグメントEBITDA＋調整額＝連結EBITDA）を検算するため、consolidated_op_profit欄に連結EBITDAを格納している。IFRS連結営業利益(FY2021 4,605/FY2022 874/FY2023 8,870/FY2024 5,017/FY2025 4,066百万円)は本文の財務サマリーで別途明示する。",
    "hq_overhead欄はセグメント注記の『調整額』（セグメント間取引消去＋全社費用按分を含む）を符号付きで格納。inter_segment_eliminationは二重計上回避のため0とし調整額に集約。",
    "segment_profit_rates は意図的に未設定。レノバのEBITDA率はセグメント売上収益(外部＋内部)を分母に開示されるが、gateのcheck#3は外部売上を分母に再計算するため定義不一致でFAILとなる。本文では分母定義(外部＋内部)を明記したうえで率を提示。",
    "geographic_sales は有報で連結売上収益と整合する地域別開示が乏しく未設定（ベトナム陸上風力等の海外比率は小さい）。",
    "table_b はセグメント売上収益(外部＋内部、発電68,292/開発・運営6,102)とセグメントEBITDA(発電26,823/開発・運営537)で構成比を算出。発電事業に内部売上はなく、開発・運営事業の内部売上4,148(AM/OM・管理報酬)を含む。",
    "FY2024のセグメント利益はFY2025有報での遡及修正後（受取配当金1,695百万円を金融収益→その他の収益へ振替、開発・運営事業 △3,472→△1,777、調整額 △2,044→△3,740、連結EBITDA16,712は不変）。",
    "FY2026/3は2026-05-19時点で有報未提出のため periods 未収録。公開（決算短信/説明会）ベースで売上収益876.22億円(+24.7%)・営業利益82.83億円(+103.7%)・親会社帰属純利益33.08億円・蓄電所着工260MW等は本文に出典付きで参考記載。",
    "市場カードの『洋上風力 導入目標』はGW指標であり円建て市場規模ではない。size=10はGW値の便宜数値で、本文では円換算しない旨を明記（vintage/kind/source必須要件のみ満たす）。",
    "share の company_revenue_oku=702はFY2025連結売上収益(702.46億円)。market_size_oku=48,000はFIT/FIP買取総額4.8兆円。算出シェア約1.5%は『国内再エネ収益プールに対するレノバの相対規模』のオーダー感であり、特定電源の市場占有率ではない旨を本文で明記。",
    "大株主は FY2025有報(2025-03-31現在)。ブラックロック等の大量保有報告(約3.3%, 2024-05-08縦覧)は基準日実質所有数確認不能のため上位10名表に未含。"
  ]
}
